,text
65102,"tissu réutilisable magique papier chinois eau calligraphie tissu livre notebook 1.5m germenly; réutilisable tissu magique papier chinois eau calligraphie tissu livre notebook 1.5m points de vente des produits: les produits de première nécessité pour la peinture de cultiver un petit génie à partir de maintenant. quantité: 1 matériel: tissu taille: 150x43cm / 59x16.9"" spécialement conçu pour les débutants de la calligraphie chinoise pas plus tache d'encre de votre bureau ou en mode mains idéogrammes chinois eau. ce mode est très pratique pour les débutants de calligraphie chinoise commodité et portable gagner de la place après laminage facile à stocker."
31613,Parasol Droit Floride 2.5m Taupe Avec Pied - Oogarden; Son design moderne vous permettra de l'adapter parfaitement au décor de votre jardin ou au bord de votre piscine.Il dispose d'un mât en aluminium finition époxy coloris anthracite. Sa toile est en polyester 160g m² coloris taupe. Elle est dotée de 6 baleines en acier ( 1.8 x 1.2 cm) et d'une cheminée d'aération au sommet pour laisser circuler l'air et parer à un éventuel déchirement de la toile.Son ouverture et sa fermeture se font facilement grâce à sa manivelle anti-retour. Ce parasol droit est inclinable.Vendu avec son pied de parasol en plastique carré de fabrication française s'adaptant aux mâts compris entre 36 à 56 mm. Dispose d'une roulette et d'une poignée afin de faciliter le déplacement de votre parasol. Lestable avec de l'eau ou du sable (volume 40L).Pour entretenir la toile en polyester de votre parasol vous pouvez utiliser de l'eau claire et du savon.
7360,Évier De Cuisine Multifonctions Support De Rangement Multi Purpose Bowl Lavage Éponge Draihpp10177; Évier de cuisine multifonctionnel Support de rangement multi-usage lavage éponge bol égouttoir. Description: Description du produit: Matière épaisse PP sans coups de poing pas de collage coller fermement ne pas blesser le mur peut être accroché dans la salle de bain cuisine et autres tuiles mur lisse. ventouse storageThe quotidien pratique est fixe. ventouse forte aspiration est ferme sans laisser de traces. Il est facile à démonter et présente une forte capacité portante. Les petits objets peuvent être placés. La conception du bâtiment vide. Le fond de la cuve de vidange rapide est creusée et la taille du trou est uniforme. Résumer et trier. Et peuvent propreté être utilisés ordre pour stocker des gadgets de cuisine et d'autres petits objets peuvent être logés. Taille 23x14.2x10cm Matériel: PP Contenu de l'emballage: cadre de vidange 1X
9656,Serre De Jardin En Polycarbonate Intro Grow - Olivier - 990m² - Longueur : 3m84 Largeur : 2m57 Gris H 2m40; La serre Olivier de la gamme Intro Grow est une serre de jardin en aluminium d'une surface de 990 m². Ses dimensions de 2m57 de large 3m84 de long et sa hauteur max de 2m40 en font une serre très pratique. Elle possède des parois en polycarbonate 4 mm. Sa porte coulissante a une ouverture de 60 cm. La serre Olivier possède également 2 lucarnes .10 ans de garantie sur l'aluminium et 2 ans de garantie sur la peinture laquée. Embase en optionAvantages-POLYCARBONATE 4-6 mmUne matière légèrePresque incassableUne température constanteLes panneaux à double paroi offrent une isolation excellenteLes rayons solaires sont filtrésSans risque pour les enfants qui jouent- En optionBaseDescente d'eauToile d'ombrage- Couleurs aux choix: Aluminium (origine) Gris anthracite Noir et VertCaractéristiquesSurface (m2): 990Dimensions : 384m x 257m x 132/240mStructure en aluminiumParois en polycarbonate de 4mm2 lucarnes1 porte coulissante10 ans de garantie sur l'aluminium & 2 ans sur laquage
49719,Liner piscine Toi SWIMPOOL ronde Ø450 x 90cm bleu; Présentation - Liner piscine hors-sol Toi SWIMPOOL ronde Ø450 x 90cm coloris uni bleuCe liner SWIMPOOL coloris uni bleu pour piscine hors-sol Toi ronde Ø450 x 90cm d'origine constructeur remplacera efficacement votre ancien liner. D'une généreuse épaisseur de 30/100eme à fixation overlap facilitant sa mise en place ce liner vous permettra de profiter très longtemps de votre piscine hors-sol ovale. Installation aisée sans outils par une seule personne.Avantages du liner piscine hors-sol SWIMPOOLLiner 100% d'origine constructeur pour une compatibilité totale avec votre piscine hors-sol Toi. Système OVERLAP sans rail d'accroche et à fixation aisée sur la paroi de la piscine sans outils. Le système de fixation OVERLAP évite la formation de plis lors de la pose du liner. Nous vous recommandons la mise en place d'un tapis de sol avant d'installer le liner.
79409,Sauna Box Sauna portable à vapeur SPA pliable pour Fitness Rouge;  Bienvenue à worth2buy tout produit en neuf 100%. Nous testons chaque produit avant expédition faites votre achat sans souci!  Sauna Box Sauna portable à vapeur SPA pliable pour Fitness Rouge *Pliable sauna?: Puissance?: 1200 W température?: 1-10 niveaux de température *Favorise la circulation sanguine à vapeur facilite la fatigue et réduit le stress. Convient pour les soins de santé personnel?: perdre du poids supprimer les toxines réduire le stress et la fatigue générale.*Idéal après une longue journée?: avec 10 niveaux de température au choix et flexible du temps Personnalisez votre sauna vites *Mobile sauna vapeur sauna à la maison pur de repos pour le corps et l'esprit?: Cette oasis de bien-être relaxant vous à la maison
14918,1 anaccessoires inclus :panneau de contrôle digital - utilisation intuitiveverrou numérique pour plus de sécuritélarge structure : rigidité supplémentairegonfleur intégré : installation sans effortsystème d'évacuation avancé - filtrage rapide1 cartouche de filtrationmanomètre : vérification de pressionadaptateur pour tuyau d'arrosagecouverture pvc avec fermeture éclairdvd et manuel d'installation pour faciliter l'installationbon à savoir :la garantie ne prend pas en compte les dommages causés par la mauvaise utilisation du produit.détails techniques :composition et dimensions du produit :1 spa : ø 204 x h 70cmarticle livré à installer soi-même installation facile grâce à une notice et un dvd inclusdétails de livraison :livraison à domicile par notre transporteur spécialisé. vous pouvez l'installer en extérieur comme en intérieur.il est conçu en pvc armé rhino-tech très résistant et qui diminue les risques de crevaison à l'intérieur et en pvc haut de gamme sur la structure extérieure pour vous assurer une utilisation pérenne. compact avec son système de fonctionnement intégré au boudincaractéristiques produit :- dimensions : ø 204 x h 70cm- capacité : 930l- poids vide : 26kg- nombre de buses d'air : 138- puissance de chauffage : 1500w- pompe à air : 600w- pompe de filtration : 12v/35w- temps de chauffe : 15-2°c/h- commande digitale : rétro-éclairée- garantie : bassin 6 mois/électronique :
58852,JR MOTOCULTURE Combo pack Guide + chaîne CG008; Expédition rapide et soignée sous 48 Heures! Vendeur professionnel. Produit NEUF et en STOCK.
16981,Piquet d'irrigation 360 degres 4mm - Shrubler; Piquet d'irrigation 360° pour système d'irrigation dans un système hydroponique.Ce piquet d'irrigation 360° a un flux réglable.Convient à des tuyaux de 4/6mmVisser ou dévisser le piquet afin de réguler le flux d'eau plus ou moins fort.
18361,Lame de tondeuse gauche 420 mm rotation droite pour modèles MP84 et Stiga Estate Master Castelgarden; Lame de tondeuse gauche 420 mm rotation droite pour modèles MP84 et Stiga Estate Master.  Lame gauche rotation droite pour modèles mp84 et stiga estate master.  Section (mm) : 55 x 3. Référence d'origine : 82004359/0. Modèle : Adaptable. Marque : Castelgarden - ggp. Longueur (mm) : 417. Hauteur de Ventilation (mm) : 30. Alésage Central (mm) : 18. Alésage Exterieur (mm) : 85. Entraxe de fixation (mm) : 65. Poids (Kg) : 0.701.
14770,Les États-Unis Présidents Et Le Gouvernement Dans Français;
57018,Oeuvres Poétiques Tome 1;
22531,genre postcolonialisme et diversité de mouvements de femmes; résumé : le présent ouvrage s'attache à souligner la diversité et la richesse des mouvements de femmes de par le monde qui se sont organisés autour d'enjeux variés que ce soit autour du droit de vote des femmes du droit des filles à l'éducation des luttes anticoloniales des discriminations racistes envers des femmes ou divers autres droits. la réflexion sur l'intersectionnalité des catégories de genre classe race caste a permis de construire de nouveaux champs théoriques qui ont souvent précédé l'institutionnalisation du champ d'études postcoloniales cet ouvrage permet aussi que s'expriment et soient rapportés les expériences concrètes des femmes et des mouvements de femmes dans toute leur diversité et les savoirs qui sont élaborés par et avec elles. ce travail correspond à une reconnaissance non seulement des capacités d'agir mais aussi des capacités de penser de manière critique des femmes de différentes appartenances et de divers horizons culturels et auxquelles les théories féministes sont redevables.
49928,points forts : plus de 10 heures de jeu d'enquête captivante menée avec humour11 mini jeux originaux et variés : course de berline joute verbale jeu detactique labyrinthes messages secrets à décoder combat au canon jeux de logique?plus de 20 personnages de l'époque dont fouché schulmeister napoléon?une dizaine de rues et monuments de 1809 reconstitués fidèlementune qualité graphique exceptionnelle. points forts : une encyclopédie imprimable de 160 pages sur le moyen âge et 12 superbes lieux d'art roman reconstitués avec l'aide de médiévistes réputés.une aventure historique d'une qualité d'image et d'animation inégalées.12 superbes lieux du xii ème siècle reconstitués avec l'aide d'historiens réputés.amuse-toi avec des jeux surprenants comme le jeu de quintaine la joute oratoire la recette médiévale? deuxième titre après le succès de « l'emerillon enquête à la cour d'aliénor d'aquitaine ' de la collection de jeux d'aventure éducatifs sur l'histoire et le patrimoine : « villes et territoires d'europe '.
14354,caractéristiques une nouvelle campagne suivant une intrigue inédite dans une galaxie dominée par le chaosdémarrez votre campagne à chinchare et développez votre influence à travers la galaxiedes arcs narratifs secondaires : faites succomber les factions ennemies sous le joug des dieux sombres et de leurs disciplesexploitez les ressources locales pour débloquer des capacités spéciales et détruire vos ennemiscommandez et améliorez les flottes du chaos leurs amiraux et leurs capacités  configuration requise  windows - minimale os: windows 7/8/10 (64 bits)processor: intel core i5-3450 (3.1 ghz)/amd fx-6300 (3.5 ghz)ram memory: 8 gbgraphics card: 2 gb geforce gtx 660/radeon hd 7870hard disk space: 50 gb   windows - recommandée os: windows 7/8/10 (64 bits)processor: intel core i7-3820 (3.6 ghz)/amd ryzen 5 1600x (3.6 ghz)ram memory: 16 gbgraphics card: 4 gb geforce gtx 960/radeon r9 380hard disk space: 50 gb    battlefleet gothic: armada 2. armada the battlefleet gothic: armada logo battlefleet gothic the battlefleet gothic logo gw games workshop space marine 40k warhammer warhammer 40000 40000 the ?aquila' double-headed eagle logo and all associated logos illustrations images names creatures races vehicles locations weapons characters and the distinctive likeness thereof are either  or tm and/or  games workshop limited variably registered around the world and used under licence. battlefleet gothic armada 2 : chaos campaign (extension) - jeu en téléchargement;  note : nécessite le jeu original battlefleet gothic armada 2 pour fonctionner.
18622,configuration requise  windows - minimale système d'exploitation : windows 7 sp1 windows 8.1 windows 10 (64bit versions only)processeur : intel core i5 2400 @ 3.1 ghz or amd fx 6350 @ 3.9 ghzmémoire vive : 8 gb de mémoiregraphiques : nvidia geforce gtx 670 (2gb) or amd radeon r9 270x (2gb) or betterespace disque : 30 gb d'espace disque disponiblecarte son : directx 9.0c compatible sound card with latest driversnotes supplémentaires : peripherals: windows-compatible keyboard mouse headset   windows - recommandée système d'exploitation : windows 7 sp1 windows 8.1 windows 10 (64bit versions only)processeur : intel core i7-4790 @ 3.6 ghz or amd ryzen 5 1600 @ 3.2 ghzmémoire vive : 8 gb de mémoiregraphiques : nvidia geforce gtx 970 (4gb) or amd radeon r9 290x (4gb) or betterespace disque : 30 gb d'espace disque disponiblecarte son : directx 9.0c compatible sound card with latest driversnotes supplémentaires : windows-compatible keyboard mouse headset   4k 30fps configuration système d'exploitation :windows 10 (64bit versions only)processeur : intel core i7-6700 @ 3.4 ghz or amd ryzen 5 1600x @ 3.6 ghz or equivalentmémoire vive : 16gbgraphiques : nvidia geforce gtx 1070 (8gb) or amd rx vega 56 (8gb) or betterresolution: 2160pvideo preset: highdirectx: directx june2010 redistributablecarte son : directx 9.0c compatible sound card with latest driversespace disque : 30 gb available spaceperipherals: windows-compatible keyboard mouse headset   4k 60fps configuration système d'exploitation : windows 10 (64bit versions only)processeur : intel core i7-6700k @ 4.0 ghz or amd ryzen 7 1700x @ 3.4 ghz or equivalentmémoire vive : 16gbgraphiques : nvidia geforce gtx 1080 sli (8gb) or amd rx vega 56 cfx (8gb) or betterresolution: 2160pvideo preset: ultradirectx: directx june2010 redistributablecarte son : directx 9.0c compatible sound card with latest driversespace disque : 30 gb available spaceperipherals: windows-compatible keyboard mouse headset     2019 ubisoft entertainment. développez votre base et les survivants recrutez des experts pour améliorer votre base et débloquer de nouvelles possibilités et notamment celle de fabriquer des armes et de l'équipement. deluxe edition avec l'édition deluxe recevez le pack digital deluxe incluant : le pack hurk legacyle pack knightles skins 'blast-off' pour le rat4 et 'retro sci-fi' pour le m133m  à propos du jeu plongez au c¿ur d'un hope county post-apocalyptique 17 ans après une catastrophe nucléaire mondiale.
