,text
23058,Ships In Focus Record 31;
27852,Convergence Or Divergence: Alignment Of StandardsAssessment And Issues?;
7900,The Inglorious Arts Of Peace: Exhibitions In Canadian Society During The Nineteenth Century;
47827,Mahou Kishi Rayearth[Import Japonais];
72867,Disney Universe [Import Allemand] [Jeu Xbox 360]; Attention !!! Ce produit est un import  si les informations 'langues' et 'sous-titres' n'apparaissent pas sur cette fiche produit c'est que l'éditeur ne nous les a pas fournies. Néanmoins dans la grande majorité de ces cas il n'existe ni langue ni sous titres en français sur ces imports.
80085,Bi Pack Forestia  + L'ile Mysterieuse De L'oncle Ernest;
61188,Figurine Skylanders Stealth Elf Legendary;
23517,Console De Jeux Pet Électronique Numérique Mini Anniversary Edition Ctystalfighter Tenales; Jeu Pet électronique numérique Console Mini Anniversary Edition CtystalFighter Caractéristiques Nom: Crystal Guerrier Jeu Taille du corps machine: environ 6.5x5x1.7cm Couleur: noir bleu rouge blanc Matériel: ABS Langue: Anglais Jeux prépositionnés Nombre: 4 caractères Compatible avec: jeux intégrés Contenu de l'emballage 1x Handheld Console de jeux 1 x Instructions 2 x Bouton (dans la console)
39280,Rouge Et Bleu Nintendo Contrôleurs De Commutation; contrôleur de main élégant et confortable avec un design rétro qui se connecte sans fil via Bluetooth à Nintendo Switch PC et appareils Android. Le contrôleur dispose d'une batterie intégrée 300 mAh qui après une charge complète dure jusqu'à cinq heures et est chargé de type USB C câble de charge inclus. Jusqu'à quatre contrôleurs manuels peuvent être connectés à un Nintendo commutateur simultanément-. Contrôleur élégant de la main avec un design rétro- Compatible avec Nintendo Switch PC et Android- Connexion sans fil via Bluetooth- batterie intégrée 300 mAh- Dure jusqu'à cinq heures après une charge complète- chargé de type USB C- câble de charge inclus- jusqu'à quatre contrôleurs peuvent être connectés à un commutateur simultanémentLe contrôleur est tiers fabriquéSpécifications:type de batterie: Li-ionCapacité de la batterie: 300 mAhAutonomie de la batterie : 5hPort de charge: USB type CCompatibilité: Nintendo Switch PC les applicationsBluetooth: V3Largeur: 14 cmProfondeur: 6 cmHauteur: 3 cmPoids: 91 gMatériel: plastiqueCouleur: GrisLe paquet contient:1x commande manuelle1x USB de type C câble ( 75 cm)1x ManuelLe produit est livré dans son emballage d'origine.
68555,"2018 Nouvelle Mise À Niveau Rs-6 Portable Mini Console De Jeu Portable Cadeau 8bit 3.0 Pouces Couleur Lcd Enfants Couleur Joueur De Jeu Intégré 168 Jeux; Numéro du modèle:RS-6A UpgradeAffichage de couleur:OuiEcran tactile:Pas deTaille de l'écran:30 \""""Communication:USBPaquet:Pas deNom de la marque:BOYHOMModel Number:RS6AProduct name:Handheld game playerHandeld Game Player:YesPortable game player:YesGame for boy:Yes8Bit bits game console:YesGaming Console:YesVideo Game:Yes8bit game:Yes8 bit Handeld game player:Yes"
22999,Data Frog Joueurs De Jeu De Poche Avec 4.3 Pouces Hd Écran Jeu 32bit Consoles De Jeu Portables Pour Ps1 Copie Fichier De Jeu Avec 8gb; Nom de la marque:COOLBABYAffichage de couleur:Pas deTaille de l'écran:OtherEcran tactile:Pas deNuméro du modèle:handheld game playerPaquet:OuiCommunication:Bluetooth
80141,"Gonoker Rétro Portable Mini Console De Jeu De Poche 8 Bits Lecteur De Jeu De Poche Intégré 400 Jeux Classiques; Nom de la marque:GONOKERAffichage de couleur:OuiTaille de l'écran:30 \""""Ecran tactile:Pas deNuméro du modèle:HGC01Paquet:OuiCommunication:USBColor:white/black/yellow/red"
38348,Collectionnez Les Voitures De Tintin La 2 Cv Des Dupont;
12300,Cavalier Del Prado Empire Napoleonic N 70 Prince Polonais Poniatowski; figurine plomb
66317,Playstation - T-Shirt Button Icons (M);
59044,Carte Yu-Gi-Oh Lval-Fr041 Sirènorca; carte YU-GI-OH LVAL-FR041 Sirènorca NEUF FR
84701,Carte Bakugan Arène De Rv #13 - 1/47e ;
20688,Dbz Carte Dragon Ball Z Part 27 Dp Bp Carddass Gt 64;
37483,Zpocalypse : Aftermath Z-Team Beta; A propos : IIncludes four post-apocalyptic Z-team members. These miniatures are designed to work with the Zpoxalypse Squad base stands however there is nothing stopping you from using them for your own mischievous ends in any other tabletop games. Each miniature comes fully assembled and unpainted. CONTENTS - 4 Survivors Miniatures (each approx. 12x25x35mm) - 4 Zpocalypse Survivor cards - 4 Zpocalypse weapon cards - 1 scenario card
78730,Stickers D'escaliers Amovibles Avec Impression De Lune Et Nuit Halloween;
28526,Razorgor Homme-Bete / Warhammer Battle;
36293,Jeu De Billes Kéops;
27801,Nessie Le Dragon Peluche Dragon Vert Sonore Musical Jamster 19 Cm; peluche vivid imaginations
54726,Jouets Dinosaur Rempli Collection D'oeufs De Dinosaure Deformed Oeufs De Pâques Pour Les Enfants Quickio; Jouets Dinosaur Rempli Collection d'oeufs de dinosaure Deformed Oeufs de Pâques pour connaître les descriptions d'enfants. Tout neuf et de haute & nbsp; Peut-vous attirer l'attention des enfants Le cadeau parfait pour les enfants Juste juste pour une école / projet scientifique ou un rapport faveur Idéal fête ou un cadeau pour un dinosaure à thème fête d'anniversaire Fait de durable flexible en plastique ABS de longue durée. Les enfants pourront profiter des heures de Imaginative Jouez avec les dinosaures réalistes prospectifs. Non seulement les dinosaures mais aussi déformation manuelle de la forme d'un oeuf dans un dinosaure de sorte que les enfants éprouvent le plaisir de l'éclosion petits dinosaures Paquet: 4 x & nbsp; Jouet
59745,10pcs Trick Toy Simulation D'une Petite Mouche Bug Insectes Mouches Spoof Modèle Tricking Jeu; 10pcs Trick Toy Simulation Petit Bug Fly Flies Insectes Spoof Modèle Tricking Description du jeu: 100% qualité de la marque nouvelle et haute. Fait de plastique insipide naturel qui est léger et lisse. Les meilleurs jouets blague truc drôle classique pour les enfants enfants et adultes. Super à utiliser dans une blague astuce. Caméra surprise: Grand comme cadeau spécial pour vos amis ou les chiens les duper chaque fois. Faire des farces comme le gel dans des cubes de glace en remuant dans des assiettes de nourriture. Paquet: 10 x jouet mouche Simulation
66480,Zombicide : Zombie Dogz; une boite de Zombie Dogz pour le jeu ZOMBICIDE.
8139,Jeu De Cartes Opération Drapeau Blanc Pâques 90  12/17 Avril;
46418,Pour Dji 2 Zoom Drone Mavic Star Objectif De La Caméra Étanche@Pao3513-Générique; Pour DJI 2 Zoom Drone Mavic STAR Appareil photo étanche Objectif FiltersFeatures: spécialement conçue pour DJI Zoom Mavic Drone FPV camera.Efficient imperméable à l'eau; performances résistant aux rayures (couches multiples de film de revêtement) de poids .Light enclenchent la conception n'affectera pas la caméra auto-inspection.Compatible avec: DJI MavicZoom DroneSTAR FilterThis est une ligne Étoile Filter.Add un peu d'éclat à vos photos de nuit skyline scènes de rue lampadaires lampadaires phares de voiture bougies et lampes à gaz les sources de tout lieu de points de light.Package comprend (choisir un): 1 x filtre
19935,3.7v 500mah lipo temps de charge: env. 35-40 minutes temps de vol: approx.8minutes signal: 2.4ghz distance de vol: 80m fonction: attitude tenir une clé décollage / atterrissage la transmission de fpv en temps réel le fonctionnement par gravité retournement à 360 ° le mode sans tête un retour clé ascendant / descendant avant / arrière gauche / droite volant caractéristiques: avec le modèle sans tête attrayant résoudre complètement problème de perte de l'orientation pilote. mini d2wh pliable avec wifi fpv 0.3mp 2.4g caméra hd 6-axis rc quadcopter drone_3250-générique; mini d2wh pliable avec wifi fpv 0.3mp caméra hd 2.4g 6-axis rc quadcopter drone toys spécification: 100% neuf de haute qualité type d'option: 3d flips avec une agilité étonnante offre un spectacle aérien cascadeur. système de transmission de fpv en temps réel wifi qui peut capturer des photos et enregistrer des vidéos pour votre grand souvenir.
63386,Portable 3-En-1 Chargeur De Batterie Chargeur Intelligent Rapide Pour Insta 360 Une Caméra X @Doauhao4244-Générique; Portable 3-en-1 Chargeur de batterie intelligente Chargeur rapide pour Insta 360 ONE X Description de la caméra protection de court-circuit multiple protection de sécurité la puce de micro-traitement intelligent le contrôle efficace de surcharge et de court-circuit de surtension; La technologie de mise à niveau à puce charge rapide et plus intelligente avec une fonction de protection de charge rapide pour protéger la batterie; Spécifications: Nom du produit: Insta 360 x un chargeur liste d'emballage: 1 x chargeur (hors caméra et batterie)
78190,Queue Billard Américain Maple 27-Bce; Longueur : 145 cm. Jonction : 1/2 Black Implex. Embout : Collé de 13 mm sur virole plastique. Flèche : Erable canadien. Fût : Bois exotique. Longueur du fût : 77 cm. Longueur de la flèche : 74.5 cm. Compatible avec les boîtiers et les housses 1/2 pour transporter votre queue sans aucun risque.
25438,Triangle plastique Noir 508 mm-Suprême;
79488,Embouts À Visser 11mm (Par 10)-Supreme; Procédé économique possédant un pas de vis en laiton. Pour queues standard ayant un procédé de diamètre 11 mm. Nécessite un léger ponçage avant utilisation. Vendu par 10.
30599,Yo-Yo Jeux Jouet Yoyo Aluminium Et Ficelles Jonglerie Jeux D'extérieur; Montrez ce dont vous êtes capables ! Que vous soyez débutant ou expérimenté ce yo-yo en aluminium  vous permettra de réaliser rapidement des tours de plus en plus impressionnants.Convient pour tous les niveaux¿ Coloris : bleu¿ Diamètre : 57 mm¿ Poids : 60 g
17682,Jouet Mega Tap Ball Princesse Sofia Ballon 30 Cm; 1 JOUET MEGA TAP BALL MOTIF PRINCESSE SOFIA DIMENSIONS BALLON 30 CMCOULEUR ROSE MARQUE DISNEY NORMES CE
74237,Randonnée En Plein Air Escalade Imperméable Neige Guêtres Leg Cover Boot Legging Wrap Stream; Randonnée en plein air Escalade imperméable neige guêtres Leg Cover Boot Legging Wrap Caractéristiques: performances Tissu: résistant à l'abrasion léger imperméable et respirant imperméable et respirant pour protéger la pluie de neige contre des chaussures de mouillage Étanche à la poussière et anti-sable lors d'une randonnée. Conserver à l'écart des épines de cactus lorsque l'escalade ou le dessert voyage Convient à tous les types de chaussures de neige jambes adultes. Parfait pour l'escalade de la randonnée pédestre de randonnée de ski de camping de pêche et d'autres aventures en plein air GARDEZ JAMBES Nettoyage à sec: Lixada Cavalières guêtres peut parfaitement vous empêcher de tiques saleté buissons pluie d'eau épines et les roches ANTIDÉRAPANTE:-intégré renforcé bande élastique fixe fermeture supérieure à garder guêtres se tenir droit et de rester en place Légers et compacts: legging Covers est facile à plier et à ranger dans votre sac à dos DURABLES:
17564,"Enfants Chambre Princesse Dentelle Literie Ronde Dôme Déco Lit À Baldaquin Moustiquaires @Uapavmp2458; Lit bébé ronde Rideau Tente Lit Hung Dôme moustiquaire Photographie Props Feature: 100% qualité de la marque nouvelle et haute. Caractéristiques: Anneau de suspension dans centre.Dans est une jolie nouvelle lit rond canopy.Both beau et fonctionnel ajouter la romance et l'élégance à toute bedroom.Keeps les moustiques les mouches et autres dôme insects.Round gênant inclus pour installtion facile. Caractéristiques: Forme: DomeHeight: 250cm / 96.46"" (H) Matériel: Coton LinenStyle: Nordic PrincessColor: Blanc Rose Caractéristiques Gris: Coton Lin Dome Moustiquaires Curtainattractive nouveau lit rond canopyBoth belle et functionalFashion nordique Princesse StyleKids Chambre DecorationsKeeps les moustiques mouches couleur fantastique et excellent matériel donner au bébé un sommeil confortable et comme un des accessoires wonderfulphotography Pease note:. Il pourrait y avoir un peu de différence de couleur en raison des paramètres de l'écran d'ordinateur également à la différence de la méthode de mesure s'il vous plaît permettre 1-3cm dans l'écart de taille. Nous garantissons le style est le même que celui indiqué dans les images. Contenu du coffret: 1pc Dome Mosquito voilages"
22758,magideal 6 pièces bébé anneau de dentition en bois naturel forme anneau artisanat à mâcher enfants bricolage jouet; la description: bois naturel écologique qui est sûr pour le bébé à jouer comme jouet et anneau de dentition pendentif de dentition pour collier de soins infirmiers et plus encore. certificat de produit pour enfants (cpc) qa technic - conformité à l'attestation 2009 / 48ec directive sur les sécurités spécification: matériel: en bois  forme: éléphant oiseau chouette hérisson fleur coeur  épaisseur: 1 cm / 0.39 pouces  taille: 45 cm - 75 cm le forfait comprend: jouets anneau de dentition 6 pièces (chaque forme 1 pièce)   pouvoir être utilisé comme un collier avec une corde ou pour l'attacher à un clip de sucette de dentition pour éviter de le perdre.
15064,4 positions d'inclinaison 6 vitesses de balancement 10 mélodies et sons de la nature appui-tête et un siège rembourrés pour plus de confort harnais à cinq points pour plus de sécurité      quelles sont les caractéristiques techniques de la balancelle graco ? elle offre 4 positions d'inclinaison et 6 vitesses de balancement un appui-tête et un siège rembourré pour plus de confort et un harnais à 5 points pour la sécurité. balancelle lovin'hug party - graco; découvrez la balancelle bébé graco lovin'hug party pour offrir à votre enfant de vrais moment de détente et d'appaisement.
67965,Fenêtre De Verrouillage De La Sécurité Des Enfants Réfrigérateur Limite De Sécurité De Verrouillage Pour Tiroir Porte Secur Vendu En Magasin Zhufuwme; Fenêtre de verrouillage de la sécurité des enfants Réfrigérateur limite de sécurité de verrouillage pour tiroir porte Secur Noir Caractéristique: Fait de matériau en alliage de zinc surface alliage de zinc galvanisé 304 noyau de serrure en acier inoxydable pas de peinture-perte durable. Nouvelle forme des lignes douces peut être plié librement la distance de câble jusqu'à 20 cm. Domaine d'application: fenêtre ouverte externe fenêtre ouverte intérieure fenêtre coulissante fenêtre supérieure de suspension peut effectivement empêcher les enfants d'accidents causés par fenêtre excessive ouverture du processus de fermeture complète du corps de serrure prolonge la durée de vie et les portes et les fenêtres sont fermes  sûr et fiable. Le cylindre de serrure rotatif et le keyless augmenter la sécurité de la serrure de porte. Information: Nom du produit: 304 Limite de porte en acier inoxydable verrouillage Poids net: environ 175g Poids brut: environ 220g Taille: environ 16.0x 12.0 x 3.0 cm / 6.30x 4.72x 1.18in Longueur du câble:
15200,Bureau Enfant Blanc Et Bois 105 Cm Kung;
76612,propre ce rideau élégant et romantique votre maison sera plus belle et confortable; créer un plus joli et moderne pour la décoration de votre maison; de bons cadeaux pour vos parents amis et collègues; matériau choisi forte durable et moins susceptibles de déchirer ou se déchirer un travail exquis; lisse doux et confortable adapté à la maison description quantité: 2 pc couleur: comme l'image deux pièces ensemble avec plus beau style: matériel moderne: polyester (lavable) taille (l x p): 200cm x 130cm lavage des soins: lavage en machine à l'eau froide cycle délicat ne pas utiliser de javel sèche-linge. feuilles rideau tulle fenêtre traitement drapé valance 2 voile panel tissu @napoulen3364; les feuilles rideau traitement tulle fenêtre valance 2 drapé voile panel tissu point de vente du produit: filtre la lumière du jour doucement et agréablement onduler où vous pourrez profiter de la lecture et en sirotant un café à côté d'eux. contenu du coffret: 2 x note rideau de fenêtre: rideau peut être utilisé comme un rideau de porte rideau de fenêtre ou un arrière-plan pour un affichage de vitrine.
46059,Coussin De Grossesse 40 X 170 Cm Blanc; Ayez une bonne nuit de sommeil avec notre coussin de grossesse en forme de V. Il offre un appui de rembourrage à la tête au cou aux épaules au dos et au ventre. Lorsque vous allaitez cela tiendra votre bébé soutenu et élevé lorsque votre dos est rembourré. Fabriqué en microfibre de haute qualité avec remplissage de coton PP le coussin est souple et résistant. La housse de coussin peut facilement être enlevée et lavée à haute température. Couleur : BlancMatériau : Microfibre avec remplissage de coton PPTaille : 40 x 170 cm (l x L)En forme de VHousse de coussin amovible et lavableIdéal pour les femmes enceintes ou allaitantesMatériel: Polyester: 100%
26591,s4sassy sirène et étoiles de mer ocean dicorla maison taie doreiller jeter housse de coussin en tissu imprimi 2 pcs;  *  ocean housse de coussin imprimée. *  matériel: nous proposons deux options de tissu dans ces housses de coussin - l¿une est en popeline de coton et autre en velours de polyester. vous pouvez choisir le matériau de votre choix dans l'option déroulante donnée. *  le package comprend: housse de coussin 1 paire | attention: coussin uniquement remplissage / insertion non inclus. *  fermeture: ces housses de coussin sont dotées d¿une fermeture à glissière invisible de haute qualité lisse et durable.
68525,Madison Coussin De Chaise À Dossier Haut Tropic 123x50 Cm Bleu; Ce coussin de chaise Tropic de la marque Madison apporte style et tendance à votre chaise à dossier haut. Le coussin de chaise est fait de tissu de qualité pour un confort optimal avec une sangle de fixation conçue pour maintenir le coussin en place. Ajoutez un superbe look et une assise confortable à votre chaise à dossier haut avec ce beau coussin de chaise ! Couleur : bleuMatériau : tissuDimensions : 123 x 50 cm (L x l)Convient aux chaises à dossier hautAvec une sangle de fixation pour maintenir le coussin en placeRésistance à la décolorationAnti-saletéFacile à nettoyerMatériel: Coton: 50% Polyester: 50%
72631,Gamme Pro: Sucre Poudre 625 Sachets De 8 G 5kg;
60506,Carton De 10 Sachet De Chips Saveur Oignon Bret'S - Apéritif Salé - 303; Carton de 10 Sachet de Chips Saveur Oignon Bret's. Idéal pour accompagner vos apéritifs ! Le carton contient 10 Sachet de chips saveur Oignon de la marque Bret's produits en France à partir d'ingrédients rigoureusement sélectionnés. Conditionné sous atmosphère protectrice. A conserver à l'abri de la chaleur et de l'humidité. Ingrédients : Pommes de terre (Origine France)(60%) huile de tournesol (34%) oignon en poudre (21%) sel sucre arôme naturel d'oignon avec autres arômes naturels (lait blé) fromage en poudre colorant : extrait de paprika. Traces éventuelles de céleri et moutarde. Dimensions du carton : 39 x 30 x 23 cm. Dimensions d'un sachet : 28 x 19 x 6 cm environ. Contenance d'un sachet : 125 grammes. Matière de l'emballage : Carton Plastique. Couleur : Multicolore. D'autres modèles dans notre boutique. Neuf.
31235,Miel D'acacia De Hongrie Liquide Naturalim - Bocal Verre 500g;
69831,5d broderie peintures strass diamant bricolage pasted peinture point de croix _dw10208; 5d broderie peintures strass diamant bricolage pasted peinture point de croix caractéristiques: toile naturelle ecologique bonne qualité de la peinture de diamant. épissures besoin à plat contre le net ne pas avoir des fissures. 9. après un bon combat le reste de l'écart au symboles de diamants correspondant de la colle. 2. en raison de la lumière et de la différence écran la couleur de l'élément peut être légèrement différent des images.
66376,33pcs Fraises Outils Pâtisserie Sugarcraft Décoration De Gâteau Moule Fondant Icing Plong; 33pcs Pastry Cutters Tools Sugarcraft Cake Decorating Mold Fondant Icing PlungerDescription: Brand New and high quality. Suits for making cake biscuits cookies.etc. There are varies patterns to meet your need. Ideal for use with a range of Edible and Non-Edible Material including sugarpaste(rolled of fondant) Petal paste(gum paste)marzipan or craft clays. Easy to clean and use. Made of food grade materialFeatures & details: Material: Food grade plastic Color: Shown as the pictures Quantity: 10Sets (33PCS) Weight: Approx. 260gPackage Included:Set of 3 heart cutter plunger(18mm13mm8mm)Set of 3 star cutter plunger(20mm15mm9mm)Set of 3 leaf cutter plunger(40mm30mm15mm)Set of 4 rose flower(5 petals) cutter plunger(50mm40mm35mm30mm)Set of 3 sunflower (161412 petals)cutter plunger(70mm55mm45mm)Set of 4 flower (8 petals) cutter plunger(35mm27mm18mm13mm)Set of 4 small rose flower (5 petals) cutter plunger(20mm11mm9mm7mm)Set of 3 butterfly cutter plunger(45mm37mm30mm)Set of 3 big star cutter plunger(43mm35mm22mm)Set of3 flower(10 petals) cutter plunger(40mm35mm25mm)Notice: Please allow 1-3mm error due to manual measurement. Please make sure you do not mind before you bid.The colors may have different as the difference displayplease understand.
29890,comment faire pour installer: retirez la poignée nettoyer la surface de cage d'escalier ¿uvres d'art de bande à l'escalier lentement commencer à éplucher la feuille vers le bas peler et coller tout le chemin éliminer les bulles d'air à l'aide d'une raclette en plastique repositionner si nécessaire profitez de votre espace paquet inclus : 1 rouleau de voiture (dont 6 pcs autocollants) différences de moniteur d'ordinateur entraînent des aberrations chromatiques avec les produits réels. matériel: auto-adhensive pvc taille: 18x100cm / 1pc afin de fournir une installation facile tout l'autocollant d'escalier contient 6 (chaque partie est 18x100cm) l'autocollant peut faire toute votre escalier plus beautiful.it peut vous donner un effet visuel distinctif autocollant peintures murales sont fabriqués à partir de pvc écologique qui est 100% durable et waterproof.easily appliquée par pelage le support de la pellicule protectrice peintures murales autocollants sont faciles à installer et à enlever. ils se détachent facilement sans laisser une marque sur votre escalier et peut facilement utiliser à nouveau c'est un produit de bricolage de sorte que vous recevrez l'autocollant contient 6 parties et vous devez les mettre ensemble par vous-même le produit ne convient pour les supports lisses tels que verre métal escaliers sans poussière etc.
16985,couleur : beige (avec des empreintes de pattes noires) matériaux: structure en bois + corde sisal + peluche douce dimensions totales : 97 x 40 x 150 cm (l x i x h) dimensions de la maison : 30 x 25 cm (diamètre x h) diamètre du hamac : 30 cm taille de la base : 60 x 35 cm (l x l) avec échelle maison hamac griffoir et plate-forme matériel: polyester: 100% arbre à chat et griffoir sisal 150 cm empreintes de pattes beige; offrez à vos amis félins un avant-goût du luxe avec notre arbre à chat rempli de fonctionnalités ! ce centre de jeu à plusieurs étages doté d'un cadre solide recouvert d'une peluche douce et confortable est la retraite idéale où vos chats puissent se gratter grimper se percher se cacher et se reposer.
54610,au sel la neige la neige fondante et tout ce trottoir brut. & nbsp; gardez votre petit chien au chaud tout l'hiver - lorsque les coups de temps froid assurez-vous que votre petit chien ne frissonne et reste chaud avec le matériau souple et confortable. for poids: 6-9kg / 13.2-19.8lb & nbsp; & nbsp; & nbsp; & nbsp; & nbsp; & nbsp; & nbsp; & nbsp; & nbsp; & nbsp; & nbsp; & nbsp; & nbsp; fabriqué en polyester pour maintenir l'humidité comme la pluie verglaçante ou de la neige et pour aider à garder l'air chaud de sorte que votre chien reste toujours chaud.
64968,Aquarium Paysage Décoratif Aquarium Simulation Deadwood Accessoires; Aquarium Paysage décoratif Aquarium Simulation Deadwood Accessoire Feature: 100% qualité de la marque nouvelle et haute. Matière: résine synthétique durable nature sûr et respectueux de l'environnement. Créer un milieu de vie naturel pour les poissons. Aquariums et accessoires Taille: 11 * 8 * 5.5cm Il est pratique et facile à utiliser. Contenu du coffret: 1pc Plantes Aquariums Décoration
62791,Echos De Paris (L') N° 11802 Du 08/12/1916 - Les Diverses Familles Spirituelles De La France Les Protestants - La Grece De Constantin Bloquee Par Les Allies - Ce Qui Se Passe A Athenes Une Note Du Foreign Office Article De Maurice Barres - Les Cam...;
34624,Pelerin (Le) N° 2339 Du 22/01/1922 - Un Aumonier Canadien - Les Mains Emportees - Confesse Et Fait Communier Un Soldat Mourant - Lecoultre - Charlatanisme Par Brousset.;
29549,France Football N° 2243 Du 04/04/1989; TAPIE - BEZ - REAL - MILAN - B. SCHUSTER - R. GUILLIT - COUPE - LES TIMBRES DU FOOT.
44356,Lot Manga Beelzebub 17 Tomes !;
25016,Lot 12 Revues + 4 Hors Série Science Et Vie Année 1982;
21470,6 Romans Dans Lot De 3 Livres Duo;
16872,Lot Jeux Vidéo Ps4;
83540,Lot De Console Et Jeux;
40065,Lot Ensemble Collection - Les Jeux Vidéo Nintendo : Princesse Peach : Jeu Ds + Prochette 2ds + Coque Ipod Touch Ipod Touch;
83947,Talens Pastel À L'huile Van Gogh 24 Pastels; 24 pastels
76300,Elba Lot De 3 Sachets De 100 Pochettes Perforées A4 Pp 4/100eme; ELBA Pochettes perforées format A4 transparent en PP005 mm grené côté supérieur ouvert perforation Eurocontenu: 100 pièces(970386 / 100206882)
